id,type,title,titleLink,description,icon,macScript,macEnabled,linuxScript,linuxEnabled,windowsScript,windowsEnabled
cardAppVSCode,app,Visual Studio Code,https://code.visualstudio.com/,Visual Studio Code is a code editor redefined and optimized for building and debugging modern web and cloud applications. Visual Studio Code is free and ...,https://code.visualstudio.com/assets/images/code-stable.png,brew install --cask visual-studio-code,true,,false,,false
cardAppVSCodeInsiders,app,Visual Studio Code (Insiders),https://code.visualstudio.com/insiders/,For early adopters you can get the latest release of VS Code each day with the Insiders Build. Available on Mac Linux and Windows...,https://upload.wikimedia.org/wikipedia/commons/thumb/4/4b/Visual_Studio_Code_Insiders_1.36_icon.svg/512px-Visual_Studio_Code_Insiders_1.36_icon.svg.png?20190606225929,brew install --cask visual-studio-code-insiders,true,,false,,false
cardAppPostman,app,Postman,https://www.postman.com/,Postman is an API platform for building and using APIs. Postman simplifies each step of the API lifecycle and streamlines collaboration so you can create ...,https://symbols.getvecta.com/stencil_92/21_postman-icon.c79f00c910.svg,brew install --cask postman,true,,false,,false
cardAppDocker,app,Docker,https://docs.docker.com/get-docker/,Docker is a set of platform as a service (PaaS) products that use OS-level virtualization to deliver software in packages called containers...,https://www.docker.com/wp-content/uploads/2022/03/vertical-logo-monochromatic.png,brew install docker docker-compose docker-machine,true,,false,,false
cardAppRectangle,app,Rectangle,https://rectangleapp.com/,Rectangle. Move and resize windows in macOS using keyboard shortcuts or snap areas...,https://repository-images.githubusercontent.com/193162629/0227dd00-2825-11eb-9ef2-6d36f9636d4e,brew install --cask rectangle,true,,false,,false